User,Product,Features 1,Features 2,Features 3
1,Shoes,Price comparison, Exclusive deals, Brand comparison
2,T-Shirt,Price history tracking, Coupons, Trend analysis
3,Headphones,Price comparison, Product reviews, Stock alerts
4,Laptop,Warranty information, Product specifications, Price alerts
5,Smartphone,Discounts and promotions, User ratings, Price trend forecast
6,Watch,Price comparison, Gift ideas, Limited edition alerts
7,Tablet,Price comparison, Accessories recommendations, Product reviews
8,Camera,Photography tips, Bundle deals, Price history tracking
9,Home Appliances,Price comparison, Energy efficiency ratings, Warranty details
10,Gaming Console,Price comparison, Game bundles, User ratings
11,Books,Price comparison, Author recommendations, New arrivals
12,Electronics, Open-box deals, Expert reviews,Price comparison
13,Furniture, Space-saving options,Price comparison, Home decor trends
14,Jewelry, Gemstone information,Price comparison, Customization options
15,Toys, Age-appropriate recommendations,Price comparison, Educational value
16,Health & Beauty,Price comparison, Ingredient details, Personalized skincare
17,Sports Equipment, Upcoming releases, Fitness guides,Price comparison
18,Groceries, Subscription options, Nutritional information,Price comparison
19,Tools & Home Improvement, DIY project ideas,Price comparison, Durability ratings
20,Clothing,Price comparison, Size recommendations, Fashion trends
21,Smartwatch,Price comparison, Fitness tracking, Compatibility with devices
22,Backpack, Anti-theft features, Material recommendations,Price comparison
23,Kitchen Appliances, Energy efficiency,Price comparison, Recipe suggestions
24,Outdoor Gear, Weatherproof ratings,Price comparison, Adventure destinations
25,Beauty Products, Skin type recommendations,Price comparison, Makeup tutorials
26,Musical Instruments, Skill level recommendations,Price comparison, Instrument maintenance
27,Car Accessories,Price comparison, Installation guides, Compatibility with vehicles
28,Food Delivery,Restaurant recommendations, Dietary options, Delivery time estimates
29,Travel Packages,Destination highlights, Travel insurance options, Local experiences
30,Art Supplies,Price comparison, Art style suggestions, Art technique tutorials
31,Pet Supplies,Price comparison, Pet breed recommendations, Pet health guides
32,Computer Software,Price comparison, System requirements, Software updates
33,DIY Tools, Project tutorials,Price comparison, Safety tips
34,Fitness Equipment, Workout routines, Space-saving options,Price comparison
35,Home Decor, Seasonal decorations, Interior design trends,Price comparison
36,Office Furniture, Office organization tips,Price comparison, Ergonomic recommendations
37,Sneakers, Sneaker care tips,Price comparison, Sports-specific features
38,Car Electronics, Car model compatibility,Price comparison, Installation guides
39,Mobile Accessories,Price comparison, Compatibility with phone models, Tech news
40,Watches,Price comparison, Watch movements, Watch care guides
41,Audio Devices, Audio quality ratings,Price comparison, Soundproofing tips
42,Game Consoles, Multiplayer game recommendations,Price comparison, Console setup guides
43,Virtual Reality, VR game recommendations, VR headset reviews,Price comparison
44,Handbags, Storage solutions, Material recommendations,Price comparison
45,Cameras,Price comparison, Photography tips, Camera accessories recommendations
46,Power Tools, Project ideas,Price comparison, Tool safety guides
47,Smart Home Devices, Security features, Home automation guides,Price comparison
48,Outdoor Furniture, Weather resistance,Price comparison, Outdoor living space ideas
49,Cookware, Cooking tips, Recipe suggestions,Price comparison